{
  "schemaVersion": "1.0",
  "id": "refactor",
  "name": "Behavior-preserving refactor",
  "description": "Improve structure or readability while preserving the current contract and proving that behavior stayed stable.",
  "outcomes": [
    { "id": "clarity", "description": "The targeted code has a simpler structure or clearer ownership without feature expansion.", "evidence": ["before and after diff", "rationale note"] },
    { "id": "stability", "description": "Characterization and regression checks confirm the existing behavior remains intact.", "evidence": ["test output", "closure receipt"] }
  ],
  "prerequisites": [
    { "id": "contract", "description": "The current behavior and public or internal contract are understood well enough to characterize.", "check": "Record inputs, outputs, errors, and side effects before editing." },
    { "id": "scope", "description": "The refactor can stay inside a sibling file scope without changing a neighboring contract.", "check": "Inspect active lanes and name the exact relative scope." }
  ],
  "lanes": [
    { "laneId": "characterize-refactor", "fileScope": "test/characterization", "objective": "Capture the current contract and a representative regression baseline.", "mode": "audit", "dependsOn": [], "deliverables": ["characterization checks", "baseline result"], "commands": ["git status --short", "git diff --check"] },
    { "laneId": "reshape-refactor", "fileScope": "src/refactor", "objective": "Reshape the implementation mechanically while leaving behavior and interfaces stable.", "mode": "build", "dependsOn": ["characterize-refactor"], "deliverables": ["refactor diff", "updated comments when needed"], "commands": ["git diff --stat", "git diff --check"] },
    { "laneId": "regress-refactor", "fileScope": "test/refactor", "objective": "Run characterization, relevant suite checks, and a final behavior comparison.", "mode": "audit", "dependsOn": ["reshape-refactor"], "deliverables": ["regression result", "redacted comparison"], "commands": ["git diff --check", "git log -1 --oneline"] }
  ],
  "toolCapabilities": ["inspect", "edit", "test", "evidence", "receipt"],
  "qualityGates": [
    { "id": "characterized", "description": "Representative behavior is recorded before the implementation is reshaped.", "evidence": ["baseline output", "contract note"] },
    { "id": "mechanical", "description": "The diff changes structure and naming without adding a new feature or hidden behavior.", "evidence": ["diff review", "scope check"] },
    { "id": "stable", "description": "Regression checks pass and the last known-good integration point remains identifiable.", "evidence": ["test output", "canonical reference"] }
  ],
  "ownerConfirmationBoundaries": [
    { "id": "credentials", "action": "Enter a password, one-time code, passkey, or challenge response.", "boundary": "Stop and hand the entry to the owner; prepare context without typing or recording the secret.", "requiresConfirmation": true, "reason": "Authentication material is a human-only boundary." },
    { "id": "live-impact", "action": "Change billing, account security, destructive data, or live financial behavior during a refactor.", "boundary": "Stop before the action and obtain one explicit owner confirmation for that individual action.", "requiresConfirmation": true, "reason": "A refactor should be behavior-preserving and safely testable." }
  ],
  "rollbackRescue": { "rollbackPlan": "Preserve the characterization baseline and return to the last known-good integration point if behavior differs.", "rescueSteps": ["Capture the before and after check summaries.", "Keep the refactor diff isolated from feature work.", "Abandon the lane when the contract cannot be explained."], "stopConditions": ["The current contract is not observable.", "A proposed change alters behavior or scope.", "A protected owner boundary is reached."] },
  "closureReceiptRequirements": { "requiredFields": ["laneId", "outcome", "closedAt", "canonicalRef", "tests", "evidence"], "evidence": ["characterization result", "diff review", "regression result"], "redactionRules": ["Omit credentials, tokens, private paths, and personal data.", "Summarize behavior without copying sensitive payloads."], "terminalOutcomes": ["merged", "abandoned"] }
}
