{
  "schemaVersion": "1.0",
  "id": "dependency-upgrade",
  "name": "Dependency upgrade",
  "description": "Upgrade one dependency as a bounded compatibility exercise with advisory, licensing, lockfile, and runtime evidence.",
  "outcomes": [
    { "id": "delta", "description": "The requested dependency delta and transitive impact are documented with a compatibility decision.", "evidence": ["version summary", "advisory result"] },
    { "id": "verified", "description": "Lockfile, build, and relevant runtime checks pass or the upgrade is safely abandoned.", "evidence": ["check output", "redacted closure receipt"] }
  ],
  "prerequisites": [
    { "id": "support", "description": "The supported runtime range, reason for the update, and release notes are available.", "check": "Read the package changelog and identify breaking or security changes." },
    { "id": "baseline", "description": "The current dependency state has a reproducible install and relevant test baseline.", "check": "Record safe version and test facts without copying registry credentials." }
  ],
  "lanes": [
    { "laneId": "audit-dependency", "fileScope": "notes/dependency-upgrade", "objective": "Review advisories, license notes, release changes, and compatibility risk.", "mode": "audit", "dependsOn": [], "deliverables": ["upgrade decision", "risk note"], "commands": ["git status --short", "git diff --check"] },
    { "laneId": "apply-dependency", "fileScope": "package/dependency", "objective": "Apply the single dependency and lockfile change inside the reserved scope.", "mode": "build", "dependsOn": ["audit-dependency"], "deliverables": ["dependency delta", "lockfile diff"], "commands": ["git diff --stat", "git diff --check"] },
    { "laneId": "verify-dependency", "fileScope": "test/dependency-upgrade", "objective": "Run install, build, focused tests, and relevant compatibility checks.", "mode": "audit", "dependsOn": ["apply-dependency"], "deliverables": ["verification result", "redacted evidence"], "commands": ["git diff --check", "git log -1 --oneline"] }
  ],
  "toolCapabilities": ["inspect", "edit", "test", "build", "dependency", "security", "receipt"],
  "qualityGates": [
    { "id": "reviewed", "description": "Advisory, license, release-note, and transitive compatibility risks have a recorded disposition.", "evidence": ["risk note", "advisory summary"] },
    { "id": "locked", "description": "The lockfile and dependency manifest describe the same intentional delta.", "evidence": ["lockfile diff", "manifest review"] },
    { "id": "runtime", "description": "Relevant build and test checks pass without hiding unsupported runtime behavior.", "evidence": ["build result", "test result"] }
  ],
  "ownerConfirmationBoundaries": [
    { "id": "credentials", "action": "Enter a password, one-time code, passkey, or challenge response for a package source.", "boundary": "Stop and hand the entry to the owner; use an approved environment without recording secret material.", "requiresConfirmation": true, "reason": "Authentication material is a human-only boundary." },
    { "id": "live-impact", "action": "Change billing, account security, destructive data, or live financial behavior while updating a dependency.", "boundary": "Stop before the action and obtain one explicit owner confirmation for that individual action.", "requiresConfirmation": true, "reason": "Dependency changes should be verified offline or in a safe preview." }
  ],
  "rollbackRescue": { "rollbackPlan": "Restore the previously reviewed dependency state through a deliberate inverse change if compatibility or supply-chain evidence fails.", "rescueSteps": ["Capture version, advisory, and check summaries without credentials.", "Keep manifest and lockfile changes isolated.", "Record the failing runtime or license condition and abandon safely."], "stopConditions": ["The package source or release cannot be verified.", "A breaking change lacks a migration path.", "A protected owner boundary is reached."] },
  "closureReceiptRequirements": { "requiredFields": ["laneId", "outcome", "closedAt", "canonicalRef", "tests", "evidence"], "evidence": ["version delta", "advisory and license result", "build and test result"], "redactionRules": ["Omit registry credentials, tokens, private paths, and personal data.", "Record package names and versions without secret configuration."], "terminalOutcomes": ["merged", "abandoned"] }
}
