{
  "schemaVersion": "1.0",
  "id": "mobile",
  "name": "Mobile change",
  "description": "Build and verify one mobile behavior across the smallest supported platform and device matrix with safe lifecycle evidence.",
  "outcomes": [
    { "id": "behavior", "description": "The requested mobile journey behaves correctly for its platform, input, lifecycle, and offline states.", "evidence": ["device result", "focused checks"] },
    { "id": "coverage", "description": "The receipt names tested variants, unsupported combinations, and the safe follow-up path.", "evidence": ["variant matrix", "redacted visual evidence"] }
  ],
  "prerequisites": [
    { "id": "platforms", "description": "Supported platform versions, input modes, lifecycle states, and visual success criteria are known.", "check": "Write the smallest meaningful device matrix before editing." },
    { "id": "fixtures", "description": "The journey can use deterministic fixtures without signing material or private device data.", "check": "Confirm local or safe preview data is enough for the checks." }
  ],
  "lanes": [
    { "laneId": "frame-mobile", "fileScope": "notes/mobile", "objective": "Define platform, input, lifecycle, offline, accessibility, and evidence expectations.", "mode": "audit", "dependsOn": [], "deliverables": ["mobile brief", "variant matrix"], "commands": ["git status --short", "git diff --check"] },
    { "laneId": "build-mobile", "fileScope": "src/mobile", "objective": "Implement the scoped mobile behavior with deterministic fixtures and safe lifecycle handling.", "mode": "build", "dependsOn": ["frame-mobile"], "deliverables": ["mobile change", "focused checks"], "commands": ["git diff --stat", "git diff --check"] },
    { "laneId": "verify-mobile", "fileScope": "test/mobile", "objective": "Run the supported device and lifecycle matrix and record visual or interaction evidence.", "mode": "audit", "dependsOn": ["build-mobile"], "deliverables": ["matrix result", "redacted evidence"], "commands": ["git diff --check", "git log -1 --oneline"] }
  ],
  "toolCapabilities": ["inspect", "edit", "test", "preview", "mobile", "receipt"],
  "qualityGates": [
    { "id": "matrix", "description": "Each supported platform and representative input or lifecycle variant has a result.", "evidence": ["variant matrix", "device output"] },
    { "id": "behavior", "description": "The intended journey, offline behavior, and failure state work without hidden signing dependencies.", "evidence": ["interaction result", "failure-state result"] },
    { "id": "evidence", "description": "Visual and test evidence is redacted and clearly states unsupported combinations.", "evidence": ["redacted capture", "coverage note"] }
  ],
  "ownerConfirmationBoundaries": [
    { "id": "credentials", "action": "Enter a password, one-time code, passkey, or challenge response for a device or service.", "boundary": "Stop and hand the entry to the owner; keep signing and account material out of the lane.", "requiresConfirmation": true, "reason": "Authentication material is a human-only boundary." },
    { "id": "live-impact", "action": "Publish a live build, change billing or account security, perform destructive work, or execute live financial behavior.", "boundary": "Stop before the action and obtain one explicit owner confirmation for that individual action.", "requiresConfirmation": true, "reason": "Mobile verification belongs in simulators, test devices, or safe previews." }
  ],
  "rollbackRescue": { "rollbackPlan": "Keep the previous mobile artifact or known-good integration point and narrow the matrix when a new variant fails.", "rescueSteps": ["Capture redacted platform, lifecycle, and visual results.", "Preserve the scoped implementation patch.", "Record unsupported variants rather than claiming broad coverage."], "stopConditions": ["A required platform cannot be reproduced safely.", "The change needs signing or private device data.", "A protected owner boundary is reached."] },
  "closureReceiptRequirements": { "requiredFields": ["laneId", "outcome", "closedAt", "canonicalRef", "tests", "evidence"], "evidence": ["platform and variant matrix", "lifecycle result", "redacted visual evidence"], "redactionRules": ["Omit signing material, credentials, tokens, private paths, and personal device data.", "Record platform names and safe build identifiers only."], "terminalOutcomes": ["merged", "abandoned"] }
}
